director_name,actor_1_name,actor_2_name,actor_3_name,genres,movie_title,comb
Jeymes Samuel,Jonathan Majors,Idris Elba,Zazie Beetz,Western,the harder they fall,Jonathan Majors Idris Elba Zazie Beetz Jeymes Samuel Western
Will Sharpe,Benedict Cumberbatch,Claire Foy,Andrea Riseborough,Drama History Comedy,the electrical life of louis wain,Benedict Cumberbatch Claire Foy Andrea Riseborough Will Sharpe Drama History Comedy
Agata Alexander,Alex Pettyfer,Alice Eve,Annabelle Wallis,Science Fiction,warning,Alex Pettyfer Alice Eve Annabelle Wallis Agata Alexander Science Fiction
Rebecca Hall,Tessa Thompson,Ruth Negga,André Holland,Drama,passing,Tessa Thompson Ruth Negga André Holland Rebecca Hall Drama
"Matt Angel, Suzanne Coote",Kate Siegel,Jason O'Mara,Dulé Hill,Mystery Thriller Action Science Fiction,hypnotic,"Kate Siegel Jason O'Mara Dulé Hill Matt Angel, Suzanne Coote Mystery Thriller Action Science Fiction"
Scott Cooper,Keri Russell,Jesse Plemons,Jeremy T. Thomas,Drama Horror Mystery,antlers,Keri Russell Jesse Plemons Jeremy T. Thomas Scott Cooper Drama Horror Mystery
Matthias Schweighöfer,Matthias Schweighöfer,Nathalie Emmanuel,Ruby O. Fee,Action Thriller Crime Comedy,army of thieves,Matthias Schweighöfer Nathalie Emmanuel Ruby O. Fee Matthias Schweighöfer Action Thriller Crime Comedy
Amy Koppelman,Amanda Seyfried,Finn Wittrock,Jennifer Carpenter,Drama,a mouthful of air,Amanda Seyfried Finn Wittrock Jennifer Carpenter Amy Koppelman Drama
Joanna Hogg,Honor Swinton Byrne,Jaygann Ayeh,Richard Ayoade,Drama,the souvenir part ii,Honor Swinton Byrne Jaygann Ayeh Richard Ayoade Joanna Hogg Drama
William Eubank,Emily Bader,Roland Buck III,Dan Lippert,Horror Mystery,paranormal activity: next of kin,Emily Bader Roland Buck III Dan Lippert William Eubank Horror Mystery
"Philip Gelatt, Morgan Galen King",Richard E. Grant,Lucy Lawless,Patton Oswalt,Animation Fantasy Action Horror,the spine of night,"Richard E. Grant Lucy Lawless Patton Oswalt Philip Gelatt, Morgan Galen King Animation Fantasy Action Horror"
Justine Bateman,Olivia Munn,Luke Bracey,Justin Theroux,Drama,violet,Olivia Munn Luke Bracey Justin Theroux Justine Bateman Drama
Michael Mailer,Michael Shannon,Alexander Ludwig,Charles Melton,Drama,heart of champions,Michael Shannon Alexander Ludwig Charles Melton Michael Mailer Drama
Chloé Zhao,Gemma Chan,Richard Madden,Kumail Nanjiani,Science Fiction Action Adventure,eternals,Gemma Chan Richard Madden Kumail Nanjiani Chloé Zhao Science Fiction Action Adventure
Rawson Marshall Thurber,Dwayne Johnson,Ryan Reynolds,Gal Gadot,Action Comedy Crime,red notice,Dwayne Johnson Ryan Reynolds Gal Gadot Rawson Marshall Thurber Action Comedy Crime
Miguel Sapochnik,Tom Hanks,Caleb Landry Jones,unknown,Science Fiction Drama Adventure,finch,Tom Hanks Caleb Landry Jones unknown Miguel Sapochnik Science Fiction Drama Adventure
Pablo Larraín,Kristen Stewart,Timothy Spall,Jack Farthing,Drama History,spencer,Kristen Stewart Timothy Spall Jack Farthing Pablo Larraín Drama History
David Hackl,Mel Gibson,Scott Eastwood,Tyrese Gibson,Action Thriller,dangerous,Mel Gibson Scott Eastwood Tyrese Gibson David Hackl Action Thriller
Hernán Jiménez,Nina Dobrev,Jimmy O. Yang,Darren Barnet,Comedy Romance,love hard,Nina Dobrev Jimmy O. Yang Darren Barnet Hernán Jiménez Comedy Romance
"Jim Cummings, PJ McCabe (directors/screenplay); Jim Cummings, Virginia Newcomb, PJ McCabe, Jessie Barr",Jim Cummings,Virginia Newcomb,PJ McCabe,Thriller Horror Comedy,the beta test,"Jim Cummings Virginia Newcomb PJ McCabe Jim Cummings, PJ McCabe (directors/screenplay); Jim Cummings, Virginia Newcomb, PJ McCabe, Jessie Barr Thriller Horror Comedy"
Walt Becker,Jack Whitehall,Darby Camp,Tony Hale,Family Adventure Comedy Fantasy Animation,clifford the big red dog,Jack Whitehall Darby Camp Tony Hale Walt Becker Family Adventure Comedy Fantasy Animation
Lin-Manuel Miranda,Andrew Garfield,Alexandra Shipp,Robin de Jesús,Drama Music,"tick, tick... boom!",Andrew Garfield Alexandra Shipp Robin de Jesús Lin-Manuel Miranda Drama Music
Dan Mazer,Ellie Kemper,Rob Delaney,Archie Yates,Comedy Crime Family,home sweet home alone,Ellie Kemper Rob Delaney Archie Yates Dan Mazer Comedy Crime Family
Edward John Drake,Neal McDonough,Bruce Willis,unknown,Action Thriller Science Fiction,apex,Neal McDonough Bruce Willis unknown Edward John Drake Action Thriller Science Fiction
Jane Campion,Benedict Cumberbatch,Kirsten Dunst,Jesse Plemons,Drama Western,the power of the dog,Benedict Cumberbatch Kirsten Dunst Jesse Plemons Jane Campion Drama Western
Halle Berry,Halle Berry,Shamier Anderson,Adan Canto,Drama,bruised,Halle Berry Shamier Anderson Adan Canto Halle Berry Drama
Michael Rohl,Vanessa Hudgens,Sam Palladio,Nick Sagar,Romance Comedy,the princess switch 3: romancing the star,Vanessa Hudgens Sam Palladio Nick Sagar Michael Rohl Romance Comedy
Jason Reitman,Carrie Coon,Finn Wolfhard,Mckenna Grace,Fantasy Comedy Adventure Science Fiction,ghostbusters: afterlife,Carrie Coon Finn Wolfhard Mckenna Grace Jason Reitman Fantasy Comedy Adventure Science Fiction
Reinaldo Marcus Green,Will Smith,Aunjanue Ellis,Saniyya Sidney,Drama History,king richard,Will Smith Aunjanue Ellis Saniyya Sidney Reinaldo Marcus Green Drama History
"David Silverman, Raymond S. Persi",Adam DeVine,Rachel Bloom,Zazie Beetz,Animation Comedy Family Adventure,extinct,"Adam DeVine Rachel Bloom Zazie Beetz David Silverman, Raymond S. Persi Animation Comedy Family Adventure"
Mike Mills,Joaquin Phoenix,Gaby Hoffmann,Woody Norman,Drama,c'mon c'mon,Joaquin Phoenix Gaby Hoffmann Woody Norman Mike Mills Drama
Casey Tebo,Devon Sawa,Ivana Baquero,Ryan Lee,Horror Comedy Science Fiction,black friday,Devon Sawa Ivana Baquero Ryan Lee Casey Tebo Horror Comedy Science Fiction
Abel Ferrara,Ethan Hawke,Valerio Mastandrea,unknown,War Thriller,zeros and ones,Ethan Hawke Valerio Mastandrea unknown Abel Ferrara War Thriller
Brian Patrick Butler,Nick Young,Alexandra Slade,Michael C. Burgess,Comedy Science Fiction Horror,friend of the world,Nick Young Alexandra Slade Michael C. Burgess Brian Patrick Butler Comedy Science Fiction Horror
"Byron Howard, Jared Bush, Chasire Castro Smith",Stephanie Beatriz,María Cecilia Botero,John Leguizamo,Animation Comedy Family Fantasy,encanto,"Stephanie Beatriz María Cecilia Botero John Leguizamo Byron Howard, Jared Bush, Chasire Castro Smith Animation Comedy Family Fantasy"
Ridley Scott,Lady Gaga,Adam Driver,Jared Leto,Drama History Crime,house of gucci,Lady Gaga Adam Driver Jared Leto Ridley Scott Drama History Crime
Nora Fingscheidt,Sandra Bullock,Vincent D'Onofrio,Jon Bernthal,Drama Crime,the unforgivable,Sandra Bullock Vincent D'Onofrio Jon Bernthal Nora Fingscheidt Drama Crime
Johannes Roberts,Kaya Scodelario,Hannah John-Kamen,Robbie Amell,Horror Science Fiction Action,resident evil: welcome to raccoon city,Kaya Scodelario Hannah John-Kamen Robbie Amell Johannes Roberts Horror Science Fiction Action
Michael Dowse,Neil Patrick Harris,Winslow Fegley,June Diane Raphael,Family Comedy Fantasy,8-bit christmas,Neil Patrick Harris Winslow Fegley June Diane Raphael Michael Dowse Family Comedy Fantasy
Stephen Karam,Richard Jenkins,Jayne Houdyshell,Amy Schumer,Drama,the humans,Richard Jenkins Jayne Houdyshell Amy Schumer Stephen Karam Drama
Trey Parker,Matt Stone,Mona Marshall,Kimberly Brooks,Animation Comedy TV Movie,south park: post covid,Matt Stone Mona Marshall Kimberly Brooks Trey Parker Animation Comedy TV Movie
Paul Thomas Anderson,Alana Haim,Cooper Hoffman,Sean Penn,Drama Comedy Romance,licorice pizza,Alana Haim Cooper Hoffman Sean Penn Paul Thomas Anderson Drama Comedy Romance
Michael Mayer,Michael Urie,Philemon Chambers,Luke Macfarlane,Romance Comedy,single all the way,Michael Urie Philemon Chambers Luke Macfarlane Michael Mayer Romance Comedy
Clare Knight,Isla Fisher,Tim Minchin,Eric Bana,Family Animation Adventure Comedy,back to the outback,Isla Fisher Tim Minchin Eric Bana Clare Knight Family Animation Adventure Comedy
Swinton O. Scott III,Brady Noon,Ethan William Childress,Chris Diamantopoulos,Comedy Family,diary of a wimpy kid,Brady Noon Ethan William Childress Chris Diamantopoulos Swinton O. Scott III Comedy Family
Michael Pierce,Riz Ahmed,Octavia Spencer,Janina Gavankar,Science Fiction Mystery Thriller Drama,encounter,Riz Ahmed Octavia Spencer Janina Gavankar Michael Pierce Science Fiction Mystery Thriller Drama
Valerie Weiss,Gemma Brooke Allen,Jackson Rathbone,Nick Thune,Comedy Family,mixtape,Gemma Brooke Allen Jackson Rathbone Nick Thune Valerie Weiss Comedy Family
Jared Cohn,Patrick Muldoon,Bruce Willis,Matthew Marsden,Action Thriller,deadlock,Patrick Muldoon Bruce Willis Matthew Marsden Jared Cohn Action Thriller
Steven Spielberg,Ansel Elgort,Rachel Zegler,Ariana DeBose,Drama Romance Crime,west side story,Ansel Elgort Rachel Zegler Ariana DeBose Steven Spielberg Drama Romance Crime
Adam McKay,Leonardo DiCaprio,Jennifer Lawrence,Rob Morgan,Comedy Science Fiction Drama,don't look up,Leonardo DiCaprio Jennifer Lawrence Rob Morgan Adam McKay Comedy Science Fiction Drama
Ric Roman Waugh,Stephan James,J. K. Simmons,Alexander Ludwig,Drama,national champions,Stephan James J. K. Simmons Alexander Ludwig Ric Roman Waugh Drama
Aaron Sorkin,Nicole Kidman,Javier Bardem,J. K. Simmons,Drama History,being the ricardos,Nicole Kidman Javier Bardem J. K. Simmons Aaron Sorkin Drama History
Sean Baker,Simon Rex,Bree Elrod,Suzanna Son,Drama Comedy,red rocket,Simon Rex Bree Elrod Suzanna Son Sean Baker Drama Comedy
Peter Hutchings,Lucy Hale,Austin Stowell,Damon Daunno,Drama Comedy Romance,the hating game,Lucy Hale Austin Stowell Damon Daunno Peter Hutchings Drama Comedy Romance
Hamish Grieve,Will Arnett,Terry Crews,Geraldine Viswanathan,Animation Family,rumble,Will Arnett Terry Crews Geraldine Viswanathan Hamish Grieve Animation Family
Trey Parker,Matt Stone,Mona Marshall,Kimberly Brooks,Animation Comedy TV Movie,south park: post covid: the return of covid,Matt Stone Mona Marshall Kimberly Brooks Trey Parker Animation Comedy TV Movie
Jon Watts,Tom Holland,Benedict Cumberbatch,Zendaya,Action Adventure Science Fiction,spider-man: no way home,Tom Holland Benedict Cumberbatch Zendaya Jon Watts Action Adventure Science Fiction
Guillermo del Toro,Bradley Cooper,Cate Blanchett,Toni Collette,Crime Thriller Drama,nightmare alley,Bradley Cooper Cate Blanchett Toni Collette Guillermo del Toro Crime Thriller Drama
Maggie Gyllenhaal,Olivia Colman,Dakota Johnson,Jessie Buckley,Drama,the lost daughter,Olivia Colman Dakota Johnson Jessie Buckley Maggie Gyllenhaal Drama
Benjamin Cleary,Mahershala Ali,Naomie Harris,Glenn Close,Comedy Drama,swan song,Mahershala Ali Naomie Harris Glenn Close Benjamin Cleary Comedy Drama
George Clooney,Ben Affleck,Tye Sheridan,Lily Rabe,Drama,the tender bar,Ben Affleck Tye Sheridan Lily Rabe George Clooney Drama
Mattson Tomlin,Chloë Grace Moretz,Algee Smith,Raúl Castillo,Science Fiction Thriller,mother/android,Chloë Grace Moretz Algee Smith Raúl Castillo Mattson Tomlin Science Fiction Thriller
James Cullen Bressack,Jesse Metcalfe,Bruce Willis,Chad Michael Murray,Action Thriller Crime,fortress,Jesse Metcalfe Bruce Willis Chad Michael Murray James Cullen Bressack Action Thriller Crime
Garth Jennings,Matthew McConaughey,Reese Witherspoon,Scarlett Johansson,Animation Family Music Comedy,sing 2,Matthew McConaughey Reese Witherspoon Scarlett Johansson Garth Jennings Animation Family Music Comedy
Lana Wachowski,Keanu Reeves,Carrie-Anne Moss,Yahya Abdul-Mateen II,Science Fiction Action Adventure,the matrix resurrections,Keanu Reeves Carrie-Anne Moss Yahya Abdul-Mateen II Lana Wachowski Science Fiction Action Adventure
Matthew Vaughn,Ralph Fiennes,Gemma Arterton,Rhys Ifans,Action Comedy Adventure Thriller,the king's man,Ralph Fiennes Gemma Arterton Rhys Ifans Matthew Vaughn Action Comedy Adventure Thriller
Joel Coen,Denzel Washington,Frances McDormand,Bertie Carvel,Drama War,the tragedy of macbeth,Denzel Washington Frances McDormand Bertie Carvel Joel Coen Drama War
Denzel Washington,Michael B. Jordan,Chanté Adams,Jalon Christian,Drama Romance,a journal for jordan,Michael B. Jordan Chanté Adams Jalon Christian Denzel Washington Drama Romance
Erwin brothers,Zachary Levi,Anna Paquin,Dennis Quaid,Drama,american underdog,Zachary Levi Anna Paquin Dennis Quaid Erwin brothers Drama
"Apichatpong Weerasethakul (director/acreenplay); Tilda Swinton, Elkin Díaz, Jeanne Balibar, Juan Pablo Urrego, Daniel Giménez Cacho",Apichatpong Weerasethakul (director/acreenplay); Tilda Swinton,Elkin Díaz,Jeanne Balibar,Drama Science Fiction Mystery,memoria,"Apichatpong Weerasethakul (director/acreenplay); Tilda Swinton Elkin Díaz Jeanne Balibar Apichatpong Weerasethakul (director/acreenplay); Tilda Swinton, Elkin Díaz, Jeanne Balibar, Juan Pablo Urrego, Daniel Giménez Cacho Drama Science Fiction Mystery"
nan,nan,unknown,unknown,Drama Crime,,nan unknown unknown nan Drama Crime
